{
  "schema_version": 1,
  "policy_id": "validation-aec-research-farend-v1",
  "allowed_tiers": [
    "research-validation"
  ],
  "minimum_cases": 4,
  "required_public_sources": [
    "microsoft-aec-challenge"
  ],
  "required_scenarios": [
    "aec-farend-static",
    "aec-farend-moving"
  ],
  "minimum_cases_by_scenario": {
    "aec-farend-static": 2,
    "aec-farend-moving": 2
  },
  "minimum_pass_rate_by_scenario": {
    "aec-farend-static": 1.0,
    "aec-farend-moving": 1.0
  },
  "aggregate": {
    "min_pass_rate": 1.0,
    "min_median_output_render_corr_reduction": 0.0,
    "max_output_clip_fraction": 0.02,
    "max_output_dc_offset_dbfs": -20.0
  }
}
